{
  "identity": {
    "alert_id": "ALT-20261017-1002",
    "flow_id": "FLW-20261017-09827",
    "detector_family": "dl_ensemble",
    "timestamp": "2026-10-17T14:32:00Z",
    "dataset": "ACI-IoT-Network-2023",
    "split": "pilot"
  },
  "prediction": {
    "predicted_label": "DDoS_SYN_Flood",
    "confidence": 0.887,
    "base_learner_votes": [
      {
        "learner_name": "1D_CNN",
        "voted_label": "DDoS_SYN_Flood",
        "learner_confidence": 0.945
      },
      {
        "learner_name": "LSTM",
        "voted_label": "DDoS_SYN_Flood",
        "learner_confidence": 0.912
      },
      {
        "learner_name": "Transformer_Encoder",
        "voted_label": "Port_Scan",
        "learner_confidence": 0.528
      }
    ]
  },
  "shap_attribution": {
    "explainer_type": "GradientExplainer",
    "explained_class": "DDoS_SYN_Flood",
    "base_value": 0.081,
    "top_features": [
      {
        "rank": 1,
        "feature_name": "syn_flag_count",
        "feature_value": 18450.0,
        "shap_value": 2.185
      },
      {
        "rank": 2,
        "feature_name": "packet_rate_per_sec",
        "feature_value": 3120.4,
        "shap_value": 1.942
      },
      {
        "rank": 3,
        "feature_name": "dst_to_src_byte_ratio",
        "feature_value": 0.012,
        "shap_value": 1.258
      },
      {
        "rank": 4,
        "feature_name": "flow_duration_ms",
        "feature_value": 5912.0,
        "shap_value": -0.982
      },
      {
        "rank": 5,
        "feature_name": "avg_packet_size_bytes",
        "feature_value": 44.0,
        "shap_value": 0.695
      },
      {
        "rank": 6,
        "feature_name": "tcp_window_size_variance",
        "feature_value": 0.0,
        "shap_value": 0.584
      },
      {
        "rank": 7,
        "feature_name": "unique_dst_ports_contacted",
        "feature_value": 1.0,
        "shap_value": 0.512
      },
      {
        "rank": 8,
        "feature_name": "ack_flag_ratio",
        "feature_value": 0.001,
        "shap_value": 0.449
      },
      {
        "rank": 9,
        "feature_name": "inter_arrival_time_std_ms",
        "feature_value": 0.28,
        "shap_value": -0.321
      },
      {
        "rank": 10,
        "feature_name": "src_ip_entropy",
        "feature_value": 0.12,
        "shap_value": -0.245
      }
    ]
  },
  "evaluation_metadata": {
    "true_label": "DDoS_SYN_Flood",
    "in_train_leakage_flag": false,
    "detector_correct": true
  }
}
