{
  "identity": {
    "alert_id": "ALT-20261017-1001",
    "flow_id": "FLW-20261017-09827",
    "detector_family": "traditional_ml",
    "timestamp": "2026-10-17T14:32:00Z",
    "dataset": "ACI-IoT-Network-2023",
    "split": "pilot"
  },
  "prediction": {
    "predicted_label": "DDoS_SYN_Flood",
    "confidence": 0.942,
    "base_learner_votes": [
      {
        "learner_name": "RandomForest",
        "voted_label": "DDoS_SYN_Flood",
        "learner_confidence": 0.961
      },
      {
        "learner_name": "XGBoost",
        "voted_label": "DDoS_SYN_Flood",
        "learner_confidence": 0.923
      },
      {
        "learner_name": "MLP",
        "voted_label": "DDoS_SYN_Flood",
        "learner_confidence": 0.942
      }
    ]
  },
  "shap_attribution": {
    "explainer_type": "TreeExplainer",
    "explained_class": "DDoS_SYN_Flood",
    "base_value": 0.052,
    "top_features": [
      {
        "rank": 1,
        "feature_name": "syn_flag_count",
        "feature_value": 18450.0,
        "shap_value": 2.451
      },
      {
        "rank": 2,
        "feature_name": "packet_rate_per_sec",
        "feature_value": 3120.4,
        "shap_value": 1.832
      },
      {
        "rank": 3,
        "feature_name": "dst_to_src_byte_ratio",
        "feature_value": 0.012,
        "shap_value": 1.412
      },
      {
        "rank": 4,
        "feature_name": "flow_duration_ms",
        "feature_value": 5912.0,
        "shap_value": -0.895
      },
      {
        "rank": 5,
        "feature_name": "avg_packet_size_bytes",
        "feature_value": 44.0,
        "shap_value": 0.741
      },
      {
        "rank": 6,
        "feature_name": "tcp_window_size_variance",
        "feature_value": 0.0,
        "shap_value": 0.612
      },
      {
        "rank": 7,
        "feature_name": "unique_dst_ports_contacted",
        "feature_value": 1.0,
        "shap_value": 0.489
      },
      {
        "rank": 8,
        "feature_name": "ack_flag_ratio",
        "feature_value": 0.001,
        "shap_value": 0.421
      },
      {
        "rank": 9,
        "feature_name": "inter_arrival_time_std_ms",
        "feature_value": 0.28,
        "shap_value": -0.384
      },
      {
        "rank": 10,
        "feature_name": "src_ip_entropy",
        "feature_value": 0.12,
        "shap_value": -0.276
      }
    ]
  },
  "evaluation_metadata": {
    "true_label": "DDoS_SYN_Flood",
    "in_train_leakage_flag": false,
    "detector_correct": true
  }
}
